{
  "id": "evt_2006_hinton_deep_belief_nets",
  "type": "event",
  "title": "Geoffrey Hinton Demonstrates Deep Belief Networks",
  "date": "2006-07-01",
  "epoch": "06_quiet_revolution",
  "significance": 8,
  "summary": "Geoffrey Hinton, Simon Osindero, and Yee-Whye Teh published 'A Fast Learning Algorithm for Deep Belief Nets,' demonstrating that deep neural networks with many layers could be effectively trained using a layer-by-layer pre-training strategy with Restricted Boltzmann Machines (RBMs) followed by fine-tuning with backpropagation. This solved the 'vanishing gradient' problem that had made deep networks intractable for decades. The paper reignited interest in neural networks after a long period of marginalization and is widely regarded as the event that launched the modern deep learning era. Hinton, who had persisted with neural network research through two AI winters, was finally vindicated.",
  "entities": {
    "people": ["person_hinton_geoffrey", "person_osindero_simon", "person_teh_yee_whye"],
    "organizations": ["org_university_of_toronto"],
    "models_spawned": []
  },
  "preceded_by": ["evt_1997_deep_blue_kasparov"],
  "succeeded_by": ["evt_2009_imagenet_created"],
  "tags": ["deep_learning", "neural_networks", "pre_training", "breakthrough", "vanishing_gradient"],
  "impact_description": "Hinton's 2006 paper is the conventional starting point of the deep learning revolution. It demonstrated that deep networks were not only trainable but could outperform shallow models, reversing two decades of skepticism about neural networks. The paper attracted new researchers to neural networks, catalyzed the formation of the deep learning community, and directly led to the breakthroughs that followed: improved GPU training, AlexNet, and ultimately the transformer revolution.",
  "counterfactual": "Without Hinton's 2006 breakthrough, deep learning might have remained a fringe pursuit. The field could have continued with shallow models (SVMs, random forests) as the dominant paradigm for years longer. AlexNet (2012) would not have been possible without the theoretical foundations and renewed community interest that Hinton's work created. The entire trajectory from deep learning to transformers to LLMs depends on this ignition point.",
  "query_hooks": [
    "What started the deep learning revolution?",
    "How was the vanishing gradient problem solved?",
    "Why couldn't deep neural networks be trained before 2006?",
    "Who is the godfather of deep learning?"
  ]
}